,Review,Rating
0," la zona piu' a ridosso della sponda del fiume; facile a dirsi se non fossimo in un paese in cui questo animale riveste un ruolo di primo piano nel pantheon religioso locale; tori,",1
1," but I also managed to get the multi-functional seat in just the right position for napping,",1
2," My driver was waiting just outside the Arrivals Hall and 45 minutes later,",0
3," I’ll be chilling out at the Doubletree Hotel and as they also have an executive lounge,",1
4,"into that beckoning king-size bed with lots of pillows – unpacking can wait until tomorrow,",1
5, He is now my next best friend and I can’t wait to see what other choice cuisine selections he comes up with during my stay here.,1
6,The lounge is a bright and airy room with windows on three sides.,1
7, I have more than enough time to make friends with the staff - that always pays off.,1
8," banks and ATMS are only allowed to exchange these old notes for new,",1
9," All of this has been developed and sustained while maintaining Delhi’s green cover,",1
10," checked into the fabulous Jaypee Palace Hotel for a couple of nights,",1
11, Organized chaos ensued with people grabbing whatever seats were available and to hell with reservations….,1
12," A couple of hours later we pull into Jhansi where my 4-hour bus ride is waiting to transport me to the next port of call: Khajuraho,",1
13,remove enough branches to be able to pull the entire trunk out of the road so we could continue our journey.,1
14, The inside of the temple has rooms that are inter-connected and placed on an East/West line and constructed with spiral superstructures.,0
15," There are hotels that accept only occupants expected to die within 15 days (thankfully not part of the Hilton chain),",1
16," the bus left the hotel and during the 30-minute drive to the river’s edge,",0
17, We stayed here for about an hour before finally turning around and heading back to our departure point.,0
18, Once at the airport our first challenge: we had to call the service desk to tell them to bring out the luggage as we were not allowed to enter the airport without a ticket.,1
19, But they all gave us the same answer: during work they are not allowed to make phone calls and they do not have a phone for that.,1
20," We waited the 5 indian minutes they told us to wait (which were about 20 """"real"""" minutes) - and then,",0
21, Happily we received the luggage and then even discovered an ATM which gave out cash.,1
22," The queue was not to long,",1
23, And the queues were mainly terribly long.,0
24, We have heard of murders (luckily haven't seen anything like this) and injuries of people waiting for ATMs.,1
25, lots of shops are already closing down because people do not spend cash on buying things .,1
26, So we were waiting for them to get out of the airport.,0
27, We patiently waited and were all very happy to meet!,1
28, And we were allowed to join our guru there for the inauguration of the temple.,1
29, it is a major tourist destination and so lots of people are waiting to try and scam you in some way or other.,1
30,The hotel 'Coral Tree Homestay' has to be one of my favourites so far.,1
31, It was family owned and for dinner that evening we sat in the family's dining room and ate beautiful home cooked (and vegetarian!,1
32, I loved the room; the walls were painted in bright colours and the bedding was decorated all over with elephants.,1
33,Managed to get a reflection off the water too.,1
34," It is usually pretty efficient but with my backpack this time,",1
35," funnily enough (""""nej"""" in Dutch).",0
36,"I got an honest tuk-tuk driver for once and as well as charging me the right fare to the hostel,",1
37, The trip would prove to be far easier and more relaxing than the previous one.,1
38, About 1pm we stopped at a Hotel for lunch.,1
39,dining-room where the now familiar buffet awaited us.,0
40, having a drink with our fellow travellers and then dinner in the Buffet of the hotel but an early night was needed.,1
41, Atul introduced us to an official photographer who came with us and took photos of the group and individual couples which would be waiting for us after our visit.,1
42, We walked all round this central room and saw the stone coffins lying side by side decorated beautifully.,1
43, Then it was time to leave this magic place and return to the hotel for breakfast.,1
44,We left the hotel again at 10-30 and our first stop was at a stone cutting workshop where they use the time honoured methods seen in the decoration of the Taj.,1
45, We were shown how they do the inlays and then taken to the shop where we eventually bought a beautiful marble plate with a traditional design.,1
46, We went inside the room where Shah Jahn was imprisoned by his son and where he died.,1
47," The middle room was the bedchamber in which the 14 children were conceived,",1
48," Either side of this are the rooms for the daughters,",1
49,The last room we visited was the Hindu Palace dedicated to Shah Jahn's mother-in-law where Hindu decoration and text can be seen.,1
50, We returned to the hotel for lunch and then had the rest of the day to ourselves.,1
51," Little """"hole in the wall"""" shops sell or manufacture all sorts of things.",0
52," It was sold to us as a more up market shopping area,",0
53, however it was more a maze of run down buildings with faeces sprayed up the walls and people sleeping and living in every nook and cranny with the odd glitzy shop plonked in there!,0
54,) and embarked upon what we thought would be an easy enough 40 minute walk to India Gate.,1
55, However no one wrote that everyone else would have the same idea and we'd be standing in a queue for an hour to get in after rushing to get our tickets at 5:45am!,1
56,"The airlines person informed that we can carry the Asti,",1
57," one should be prepared to dedicate a whole day for travel alone as transit at Delhi could be issue and it happened so as it was not a transit ticket,",1
58,Our stay was fixed at Kumarasamy Mutt - http://www.,1
59, Kasi Mutt also as these two are managed by the same trust.,1
60, This Mutt also manages the Kedar gaht or Kedareshwarar Temple.,1
61, The boat man charges about Rs.,1
62,In spite of the Governments efforts the hygiene and cleanliness is still an issue though there is a hi-decibel public awareness campaign.,1
63,After a long day of travelling and waiting around.,0
64,"As such Varanasi is awash with people waiting to die,",0
65,Just before I give you some more information I just want to point out that the Ganges is one of the most polluted water bodies in the world.,0
66," but I was once told that in legal drinking water you're allowed like five bits of faecal matter per “bit”,",0
67,We stayed in Zostel again (450rs A/C dorm) and it was a short walk to the Ghats.,1
68, Although the same rules don't apply to hashish which is looked upon as an actual drug.,1
69,Bhang is basically legal throughout much of the north of India and consumed in government run shops (but still spoke about under your breath).,1
70," A retreat to the room after a couple of hours was a good idea,",0
71," so we could wait 15 hours to get the next flight for about two and half hours to Yangon,",1
72,I was really impressed that the locals have managed to set it up with guides etc.,1
73,Towards the end of the tour the guide starts to tell us about his uncle’s shop and family business of carving ornaments out of rock.,1
74, In any place near a tourist area in India there'll be some “cheating men” as the hotel owners call them.,0
75," They'll stand on the street and follow you into hotel and try getting commission for taking you there etc,",1
76, or say they can get you a cheap room and it'll be like double the price they've quoted when you get there.,1
77,We ended up going to the place I stayed at last time.,1
78," Hotel Barajang 400rs per night,",1
79, wifi and cable TV in the room.,1
80, Amazingly we were put in the same room I’d had on my last visit.,1
81, We went to the shopping area and had a KFC and got blessed with long life in a Hanuman temple.,1
82,It was like a fun house at a theme park with gods in the rooms instead of your usual amusements.,1
83," There's no way I’m giving someone money when they charge you like that,",0
84," figuring we’d had a decent night’s sleep,",1
85," there was a mini-bus waiting to take us to our hotel for the night,",1
86, Hotel Atithi.,1
87, Hotel Atithi was probably the most modern and clean hotel so far.,1
88," They had a decent small restaurant below the lobby,",1
89," air-conditioned rooms (if you had your key in the holder),",1
90," the room we were first assigned to had not be cleaned up at all,",1
91, who waited until that room was cleaned up.,1
92, besides all the rooms in numerous buildings.,1
93, we were taken back to the hotel for lunch and to freshen up.,1
94, and I had the Hotel Atithi Thali Vegetarian Plate.,1
95," Our guide restated the rules about what not to bring,",1
96, so I left my whole fanny pack in our room and Manoli went through her day bag and camera bag to be safe.,1
97," There is a rule about no gasoline-burning vehicles being allowed within 1 kilometer of the Taj,",1
98," and sure enough one of our ladies had pens and lipstick and another had two bottles of sunscreen and face cream,",0
99, with a stop at an ATM since there wouldn’t be any tomorrow at Tordi Garh.,0
100," so I stayed in the room with her and ordered mixed fruit and a Coke,",1
101, we all went back to the hotel to wait our transfer to the train station.,1
102,” Our guide reminded us that we would not be able to get much to eat on the train and recommended we order something from the hotel to take with us.,1
103," While we were waiting for the train,",0
104, we all agreed to go looking for the Blue Lassi Shop again for lunch.,1
105, except the two ladies staying near us.,0
106," We finally got off the train with our luggage and our guide recruited a number of tuk-tuk drivers to take us all to our hotel in Varanasi for the next 2 nights,",1
107, Hotel Haifa.,1
108,"Hotel Haifa was okay,",0
109, but not quite as nice or clean as the hotel in Delhi.,0
110," We went to our air-conditioned room on the 3rd floor,",1
111," The hotel offered 4 different types of breakfasts,",1
112, we went through some of the market streets to a famous shop called the Blue Lassi Shop.,1
113, we all took rickshaws or bicycle tuk-tuks back to the hotel to rest and get ready for an evening boat ride on the Ganges.,1
114, so we walked back to the hotel to retire.,1
115, We arrived at Varanasi around 2 o'clock and our yoga teachers were waiting for us with 2 vans to go to our hotel.,1
116," There were typical Indian convenience shops and lots of people on traditional Indian bicycles,",1
117,check in and went to our rooms to relaxed for a bit.,1
118,We then headed to the hotel for breakfast and a nap.,1
119, Then you started wanderkng in through the alleys and eventually you were in a maze full of shopping stalls.,1
120, Val and I decided we did not want to go in the temple and we would wait outside with Arcal one of he yoga teachers.,1
121, We got to the hotel and grabbed our yoga mats for a well deserved relaxing class and headed to the ashram.,1
122, We drank chai and chatted and ate some sprouts and headed back to hotel to pack up for our noon flight.,1
123, but the retreat was not well planned we ended up going after yoga on our own with the driver we had and spent about 10 minutes shopping while the drive back and forth to the hotel was about 45 minutes due to traffic.,1
124,Flights with IndiGo are cheap and excellent service if you book in advance.,1
125,"We stayed at """"fancy"""" for Indian stand antes hotel,",1
126, The view of the room where we did yoga (open space) was towards the Ganges.,1
127,"Fortunately our hotel looked out onto the Ghats,",1
128,"Temporary respite from the dirt and squalor of the crowded streets was provided by a western style cafe within a textile shop providing another browsing opportunity,",1
129," and then struggled to pay for it because bank connections and ATMS don't work efficiently,",1
130,"An uneventful flight to Delhi took us to a boring Ibis hotel for the night,",1
131, as a result of Peters careful management of bank cards.,1
132, You may think it must be the Dehli belly but it skipped me there and waited til we're in the colourful town of Varanasi.,1
133,Once we finally got to our hotel we crashed out for a 12 hour sleep only to wake up with a man entering our room!,1
134,took Rob to an ATM to get money out in exchange for a refund on my card that I really started to freak out.,0
135,We finally got back to our hotel from the exhausting day of being ripped off.,0
136,""""" He even discussed how a poor old couple had been scammed and sent to the wrong hotel from the airport.",1
137,waiting for our month in India to end!,1
138,Anyway I've bored you all enough for one blog!,1
139, Stay tuned for India part two.,1
140," shop keepers,",1
141," Photography is not allowed out of respect for the ceremonies,",0
142, Sanju had informed his boatman that we were interested in going on a rowboat to see the sunrise along the Ganges.,1
143, An older woman originally from Germany named Gitta lived there and occasionally they had a room available for people who wanted to spend a night or longer.,1
144, still waiting for his guests.,0
145," We went into a small room and he demonstrated five different poses,",1
146, Babaji then brought us into his other room and gave us a blessing which included a bracelet and some dye on the forehead to signify the third eye.,1
147," We sat in this small room with Babaji and a man introduced himself as an """"aromatherapist"""" and offered us chai.",1
148, Both men and women washed and beat their clothing and then placed them wherever there was room to dry.,0
149, Need to stay in shape on the road.,1
150," We found a cool clothing shop and checked out a few items,",1
151, we returned to our area and tried a good and cheap place near the guesthouse.,1
152, She had managed to get to India using standby tickets and now she had the opportunity to try for a flight leaving Delhi on this very night.,1
153, then went out and found a nice clothing and fabrics shop nearby.,1
154, This was a nice change from the general shopping experience in India.,1
155, Bev packed up all her stuff and then we walked out to one of the busier streets where a taxi was waiting to bring her to the airport.,1
156, I met up with Ricky and some friends of his who were staying in a guesthouse just down the lane from mine.,1
157," I met a few other travelers who were staying in the guesthouse,",1
158, I had already done this once with Ricky back in Udaipur and couldn't wait to try it again.,1
159," as he was actually staying at the same guesthouse as Ricky,",0
160, I ate quickly and then walked downstairs were I had arranged to meet a man named Tarak in a music shop right below Babaji's place.,1
161, I clicked Save just as the Internet shut down and my entire blog disappeared!,0
162, The Internet then didn't work last night so I'll have to do an abbreviated version while waiting in the lobby for breakfast to open.,1
163," Many temples were destroyed when the Mughais invaded (and ruled much of India until the British),",0
164, Annoyingly there is a massive queue for the foreigners who have paid 750 rupees and none for the Indians who have paid 25 rupees.,1
165,"We return eventually to the hotel for a rest and then off to the Red Fort,",1
166,"The Red Fort was for many centuries the capital of first the Lodhi sultans who ruled India before being defeated by the first Mughal Emperor Babur in 1526,",1
167, We weren’t close enough to fully appreciate their height but they did look majestic.,1
168, with shops and homes.,1
169,We arrived in Agra on the evening of the 15th and checked into another amazing hotel before heading out for our first glimpse of the Taj Mahal.,1
170,was built by the Mughals who ruled a northern India from the early 16th century until the consolidation by the British colonial rule in the early 1800s.,0
171, This is a coffee shop that is run by women who have been victims of acid attacks.,1
172, Instead I returned to the hotel and had a hand and foot massage!,1
173,I still don't understand how they manage to speed through these crowded narrow roads.,0
174," Our rooms miles away from Reception & dining room,",0
175,"Back to hotel for buffet dinner,",1
176," we managed to find one that was able to bring us to our hostel,",1
177, We waited in the queue and were finally allowed in as the sun was creeping up.,0
178, One of the balconies allowed us to see the Taj in the distance.,1
179, Had a side lower berth in the AC2 class.,1
180,Left on time but onky had about half an hour before it got dark and couldn't se any more so resorted to playing games on the tablet and bought water and crisps from the train vendors.,1
181,After chilling there for 20 mins and managing to fob off many drivers guides and touts I decided to make my was to my guesthoude which I knew was 100 meters away.,1
182, staying at Sheraton 4 Points in Agra and after third room got it lucky.,0
183,damp and peeling walls in two rooms and they smelt musty and water damaged.,0
184, so at least they acknowledged their room was crap!,0
185, Anyway all good eventually and then we headed out of the hotel for dinner.,1
186,a little bit Indianed out so went to a lovely restaurant a block or so from the hotel Manchurian Chinese.,1
187, Back to hotel for breaky and hydrate and off out again to the Red Fort.,1
188, back to Delhi tomorrow for a shopping tour in the arvo - mainly to the Spice Market - then home Wednesday.,1
189,We'd planned a bit of luxury for Agra having found a very good deal at a new Marriott - not the kind of place we would normally choose to stay but it was less than the price of a very ordinary B & B in the Dales and we thought that we might benefit from a bit of pampering.,1
190,"30am so expected to have to wait to check in but the room was already available so we indulged ourselves for a few hours with proper coffee,",1
191,But we couldn't just sit in the hotel so after lunch we walked out to the main road to pick up a tuk-tuk rather getting them to call us a car (we're probably the only people staying there who didn't go everywhere by car and we were certainly the only people staying there with backpacks that we saw!,1
192, more indulgence with dinner back at the hotel but back in the room we could hear the music from the party downstairs really loudly.,1
193,a name for ourselves as one of the waiting staff apologised for the noise and hoped we'd managed to sleep when it finished.,1
194, I asked him if there were any more parties in the hotel for the next couple of nights and he said that there weren't so it should be quiet - phew!,1
195, He wanted to take us to the East gate which was closer but we had got the impression it was quite busy with groups from the big hotels so we made him take us to the South gate.,0
196, More veggie curry then back to the hotel for coffee and cake - yum!,1
197, They were very apologetic and said that we shouldn't pay anything for the tour and could they arrange for us to be taken to some sports shops the following day to try to replace the shoes.,1
198," I explained that we would need an outdoor clothing shop and they agreed that there probably wasn't somewhere in Agra,",1
199, particularly with large enough shoes.,0
200, We were heading back to Delhi in a couple of days so said that we would try there - H had enough with him to manage.,0
201,hotel and H had to walk through reception in his socks.,0
202,It was then that things really started to go wrong at the hotel as a cold shower was followed by an engineer coming and going from our room and leaving the tap and shower running on full.,1
203, we turned all the taps off again when we couldn't wait any longer for dinner and told them at reception again.,1
204, We also asked about the music that we could already hear playing in our room because we had been told that there weren't any parties that night.,1
205, Getting very frustrated with people not telling me the truth I asked to speak to the manager on duty who eventually turned up an hour or so later just as we finished dinner.,1
206, He tried to explain the conflict between guests staying in the hotel and party guests but he didn't seem to agree that it was not appropriate to hold loud parties that could be heard in guest rooms.,1
207, he was concerned that they couldn't be certain when we would have hot water so he offered us a different room at the side of the building furthest away from the music.,1
208, He travelled to the area to see a Sufi sage who lived in a cave to get some advice because he had not managed to have a child with any of his wives.,1
209, His Hindu wife gave him a son and he stayed and built the fort and mosque.,1
210,He then rushed us around the mosque but we stood our ground and went where we wanted to take pictures before finally leaving to catch the bus and then our taxi back to Agra for a final night in luxury.,1
211, I fitted in a complimentary massage as offered by the manager the night before.,1
212,"30/01/16 out of Rajasthan on my classy AC class train (SL full) to nearby Agra,",1
213," turns out to be a French and Australian pair's hired wheels for the day,",1
214," jump on a bus and then after another find my intended district for a stay at the YWCA,",1
215," overnight stay in an eco village,",1
216,A few of the worlds population are lucky enough to see some of the great wonders here on earth.,1
217,From being laid down by Lord Lakshmana to being ruled by Mughal emperors to being the administrative capital during the British Raj to finally being the capital of Uttar Pradesh … “Lucknow” has seen it all … & how!,1
218, RSS volunteers participate in political and social movements and initially drew inspiration from European right-wing groups (including the Nazis).,1
219, now the Prime Minister of India) faced a legal process accused of complicity in initiating and not doing enough to stop the violence against Muslims in his state.,1
220, a 35 year old who was managing the Government Guest House where I stayed (it being one of two only options for foreigners).,1
221,"He was adopted but when his step-mother eventually managed to have her own child,",1
222, He then started his self-funded education and gained qualifications and better paying jobs managing businesses.,1
223, Nous lui rappelons que nous avons réclamé cette information à plusieurs reprises ; lui se montre offensé et s’énerve au point de nous dire de partir sans payer.,1
224, Le chauffeur de taxi était ponctuel et connaissait bien les itinéraires ; il nous a même fait découvrir un restaurant indien végétarien sur le chemin du retour.,1
225, nous avons rendez-vous vers 7h30 avec le chauffeur de taxi qui nous a emmenés à Agra.,0
226, Avec les embouteillages il nous faut 2h pour rejoindre l’aéroport ; il est 12h40 quand on commence la queue pour l’enregistrement.,0
227,"10 minutes plus tard (12h50) la queue n’avance pas,",1
228," but while I was traveling in India the internet was so unreliable,",0
229,"My friends and I were lucky enough to book """"guest house"""" rooms on the internet from Dehli,",1
230," Plus our room came with boat ride reservations the night of the 24th,",1
231,On Travelblog as well as from other travellers we have heard and read horrible stories about accomodation and about scams in Agra.,1
232," with cockroaches and rats running around) we were only going up to the rooftop,",0
233, So it is not a cheap thing to do.,0
234, We then organized a rowboat and rower.,1
235, These were poor men waiting to die so that they were on the spot to be cremated.,0
236,Now wait for this: dogs were there and they would find the human bones that were not fully burnt.,0
237, The area was full of soldiers because of security issues and communal tensions.,1
238,"We then went back to the hotel to have breakfast,",1
239, pack up and then move to our next hotel the Meradan Grand Hotel.,1
240, the highlight of our trip so far was this particular night when we were literally dragged into a wedding reception at our hotel by the bride's father.,1
241,We entered the reception room where there were 100s of people and the father sat us in the front row of seats…asking one person to move…very embarrassing!,1
242, The bridesmaids blocked the reception room doorway.,1
243, The groom had to buy his way into the room by placing money on the silver tray which one of the girls was carrying.,1
244, the groom entered the room and sat on a lavish lounge which was on a stage.,1
245, we checked out of our hotel and our driver took us to the airport.,1
246,We stayed at the Taj watching the sunset.,1
247,We then found Ravi waiting for us after we caught an electric bus for the 1km ride back to the car park.,1
248, we arranged a tour with one of the men who worked at the hotel as his cousin owned a boat.,1
249," We set off from the hotel expecting to jump in a tuk-tuk however we ended up walking along the road which was crowded with cars,",1
250, He showed us special viewpoints at the top of buildings and he took us to the famous Blue Lassi Shop (lassi's are yoghurt drinks mixed with a fruit of your choice).,1
251," Adil informed us that family members are not supposed to cry at cremations,",1
252,It feels surprisingly normal when you watch the ceremony which lasts 3 hours (however we only stayed for 15 minutes).,0
253," Unfortunately the tickets we had bought were on the waiting list,",1
254," With no WiFi and all shops and cafés closed,",0
255, we had no way of finding a hotel or hostel to book a room.,1
256, So we had to turn up on the doorsteps of hotels and ask if we could stay.,0
