,Review,Rating
1336," The hotel was in the best spot possible,",0
1337, about 7 shops inside it with limited stock.,0
1338," I managed to get a photo of both the sun and Taj in the same shot after running down the river bed a few hundred meters,",1
1339, It was semi-comfortable as I had to keep my big bag on my lap and there was little legroom.,1
1340, The clerk at the cloak room didn’t seem excited by his job but he gave me a little piece of paper I’d better not lose.,1
1341, waiting for lunch time.,0
1342,I managed to get to the Residency before 5PM.,1
1343, Shops were still open and people of all ages were window-shopping on the sidewalks (real sidewalks!,0
1344," walking past luxury hotels and neon cinemas (Heroine,",1
1345, I’m planning on staying in the area before I go to the train station.,0
1346, Enough to keep me entertained before my night train back to Delhi!,1
1347, I was hoping to just find a hotel after a while and get a roon there.,0
1348," The first hotel didn’t accept foreigners,",0
1349, It got a bit confusing when I had to explain to him that one hotel he brought me to was already full (It was the second one I tried earlier).,1
1350," The first hotel was full,",0
1351,"The Ram Hotel is big: large hallways,",0
1352, It’s moderately clean but the openings in the wall for the fan and under the door have allowed a few critters to get in.,1
1353, At one point a cockroach jumped onto the leg of the clerk who took me to the room and he just brushed it off.,0
1354,) and a curious gecko have been spotted in the room since then.,0
1355, I wiped my feet while some guy kept staring at me from outside the shop I was sitting in.,1
1356,) to justify my staying in the shop and left.,0
1357," a truck load of soldiers walked into the hotel for some reason,",0
1358, There was an argument between a sadhu and the guy in charge of keeping the monkeys away (he was doing a bad job by the way).,1
1359, The repugnant smell alone was enough to keep me away from exploring further.,1
1360, I walked back to the hotel and waited for the internet café to open.,0
1361,I’m planning on watching the India cricket game in the lobby of the hotel tonight (there is no TV in my room unfortunately).,1
1362, A nice shower and a paratha-with-curd breakfast gave me the strengths to hang out in my room to pack my bags for the next leg of my journey.,1
1363, I was going to watch a bit of TV under the fan until the right time but the Alka Hotel staff knew my weakness: they unplugged the satellite TV.,1
1364, I had to leave the room for the cleaners.,0
1365, He said however that he wanted one more passenger because that’s a cheap price for the ride.,0
1366, People were casually staring at me while idle rickshaws were waiting by the side of the road.,0
1367," probably in charge of chasing away monkeys,",0
1368, I waited for my train with a book.,0
1369, He crossed the bridge with me when the train was announced to arrive on the next platform and stayed close.,0
1370, So a bunch of us gathered at the hotel reception to board a boat that would leave at 6:00AM: there were two girls from Utah and a family visiting from Delhi.,1
1371, We boarded at the ghat beneath our hotel walking past people doing their morning bathing rituals.,0
1372," probably sinking her feet into inches of goo and mud and when she built enough strength,",1
1373, that rule was well-respected.,0
1374, The manager promised to give me a better room with a private bathroom for my second night.,1
1375," When the staff came into my room to get me (I was reading under the ceiling fan),",1
1376, I thought it was time to move to the next room and I could move on with my day.,1
1377, I was in hotel limbo.,0
1378," “in 30 minutes”… I was left wandering around the hotel courtyard,",1
1379, A woman and a baby were behind me just waiting for a few seconds of my attention.,0
1380, I hadn’t been in a very good mood because of the room situation and I needed some good karma so I caved.,0
1381,I still had time to write my postcards and talk to a guy checking into the hotel (“How is it like here?,0
1382, I chose to go to the roof top of the best hotel on the ghats and had some chick pea balls in a curry and coriander sauce.,1
1383,Daily nugget: As I walked back to the hotel a kid walked with me asking if I wanted to see the burning ghats.,1
1384,"Waking up this morning in the comfy bed of the Valentines Hotel in Allahabad,",1
1385, I had slept like a baby after power cuts had threatened my cricket and room service evening.,1
1386, I managed to find my seat and put myself in a cozy position with my feet dangling over the other passengers’ heads as they walked by.,1
1387, temples and restaurants until we had the hotel in sight.,0
1388,At the hotel: bad surprise.,0
1389, My room wasn’t ready.,0
1390, The Ganges’ level has risen with the rains and the room was flooded.,1
1391," I was assigned a cheaper room with a shared bathroom,",1
1392, and decided to leave my bags in my room and just explore a bit around the hotel.,0
1393, Varanasi is predictably a very touristy place and my hotel is 90% full of foreigners (lots of Chinese people).,1
1394, People from all over have gathered around a bunch of priests waiting for 7PM to start the festivities.,1
1395,"I plan on spending the evening at the hotel: shower,",0
1396,” and then the loudest firecracker exploded near a pool of mud leaving more smoke in the air than the incense from the aarti.,0
1397, I woke up to the face of Nicolas Cage (I hadn’t turned the TV off…) and left the hotel after a pretty good night.,1
1398, I got my ticket and rushed to find a comfortable seat for the next hour.,1
1399," I sat on a bench waiting for my next train,",0
1400, I upgraded my usual hotel choice and took a nice shower in a clean bathroom.,1
1401, I even ordered room service for dinner to watch some cricket (that Chris Gayle’s pretty good).,1
1402,"Jai and Mr Chowdry were nice enough to negotiate a tempo for the three of us so that we could go to Anand Bhavan,",0
1403," while waiting for the place to open (they have lunch hours…),",0
1404," The rooms of the building were left as they were with the original furniture Nehru had tea on and Ghandi slept on,",1
1405, enough for an hour walk.,0
1406, enough to have a gun almost pointed at me.,0
1407," I stopped at a shopping center for some cash,",1
1408, Cows stayed put and buses kept honking.,1
1409,The day has come to an end in Allahabad as I am about to order some food again to watch cricket in my comfy air conditioned room (Australia vs India!,1
1410, No picture is allowed of course for privacy of the family and respect.,1
1411, for some reason all the lights in my room cannot be turned off simultaneously and a power outage at 3:30 caused the noisy fan to stop turning.,1
1412, Enough to wake me up.,0
1413,Back to the hotel for a (kind of) healthy breakfast of garlic omelette and lime soda.,1
1414," Negotiation time: I managed to bring down the rickshaw trip to 250 rupees but the driver said """"275,",1
1415, You can have the area pretty much for yourself if you go early enough but you can still have some awkward encounters.,0
1416,Options for luch were limited around the Idgah bus stand so I settled for a hotel restaurant.,1
1417, I could use a tiny bit of comfort and air conditioning.,0
1418, My paleness seemed to have illuminated the lobby of the hotel as the dozen people who were there just turned toward me and froze.,1
1419, a grasshopper the size of a Bic lighter just flew into the internet cafe and landed on my leg!,1
1420,"Fatehpur Sikri is a must-see but avoid seeing it if you're not comfortable with touts,",1
1421, Back to the bus station where I managed to slalom around misinformation from ill-intentioned taxi drivers/restaurateurs/souvenir shop workers/overall crooks to find the right bus leaving at the right time.,0
1422, I am sitting in a makeshift internet cafe near the East Gate of the Taj Mahal.,0
1423, Kudos to New Delhi for having a clean and efficient international terminal.,1
1424,"I booked a prepaid taxi to take me to my cousin Henri's appartment in New Delhi,",1
1425, Easier said than done: He stank at directions (and just plain stank also).,0
1426, we stayed up until the new taxi came to bring me to the train station.,1
1427," claiming that the """"WS"""" on my ticket meant """"Wait for seat"""" and that I was on a waiting list.",1
1428," I was rubbing elbows with a teenage girl who was charging her phone on the wall next to me,",1
1429,Hotel Sheela near the East Gate of the Taj Mahal can boast a great location but a mediocre double standard room (I don't mind).,0
1430," They have a quiet courtyard with a decent restaurant (Lower your expectations,",0
1431," Leaving the hotel at 5:45am it was light,",0
1432, now polluting vehicles aren't allowed within a couple of hundred metres) was really enjoyable.,0
1433,There was no queue at the ticket booth so we quickly had our (expensive 750 rupee) tickets and had collected our 'free' shoe covers and bottle of water.,1
1434, We joined the ladies queue to go through the security check.,0
1435, We had been told by our driver that certain things (such as knives and food) are not allowed - but as we went through the bag check Marie was told her torch was not allowed and neither was her gorilla tripod.,1
1436, breakfast at the hotel was spicy pasta or curry (neither of which we were impressed about) baked beans and a boiled egg- not the continental breakfast we were supposed to get but we ate knowing we probably wouldn't want lunch as it would be too hot.,0
1437,' Then you wait in a smallish boarding area that continuously fills with people.,1
1438,Confusingly when you book the flight you're told you are not allowed to take any hand luggage on.,1
1439," boarding passes and hand luggage tags checked for stamps to say they were cleared and then queue again to get another stamp on each,",1
1440, hotel vouchers and settled the expensive bill.,1
1441, It is a different perspective driving through the chaos in a car and we are not that is entirely comfortable observing people eeking out a living behind a sheet of glass.,1
1442,It was as hot as hell and the aircon couldn't compete with the sun and Indian roads have a speed limit of 60km.,0
1443," Or the lunch stop restaraunt that charged 60 rupees for a tea (that's twice the price of a nice restaraunt),",0
1444," we took our bags up to the room despite the porter offering several times,",1
1445,Dinner at the hotel restaraunt (we were too knackered to go looking for food) took over an hour to get everything we ordered and we were the first in there - getting a roti took a record time of almost an hour and still the waiter wanted a tip.,1
1446," The manager Suny greeted me on arrival,",0
1447, and had things organised for my two day stay in a jiffy.,0
1448, I had a great afternoon thanks to my kind and informative driver.,1
1449," I jumped a taxi to the excellent Suraj guest house in the maze of streets near the sacred Ganjes,",1
1450,"We managed to get a general ticket which apparently means we were on the waiting list,",1
1451,We hopped on the first AC carriage to find the TT man (ticket man) to see whether we could get a ticket.,1
1452, put our stuff on it and wait for the TT man.,1
1453, which much to Jamie's dismay only have fans and no AC fast forward to a very sweaty train journey!,1
1454, perched precariously infront of our bags and waiting for the TT man.,1
1455, When the TT man finally came he told us we couldn't stay all one bed and he would go and find us another.,1
1456, once Olivia and I had finally found the right sitting pattern and had even managed a short doze the TT man finally made a reappearance.,0
1457," We are currently staying in Monalisa Peace Cottage which even comes with resident monkeys and night time singing,",1
1458, Nepali Temple and his shop (fortunately we managed to loose him before we had to go to his shop which obviously meant that we also got very lost).,1
1459," This I followed up with high tea at the Imperial Hotel where for about 800 rupees (about $16) you can tuck into all of the scones (complete with clotted cream),",1
1460, Up there we could see the line of dead bodies waiting to be cremated next to the Ganges.,0
1461, so we spent a chilled evening reflecting on our stay in India so far.,0
1462, Most are bathing ghats but there are a few cremation ghats and my hotel in Varanasi just happened to be right above one of them - Harishchandra Ghat - about 50 meters from the river bank.,1
1463, Behind the hotel is an enormous supply of wood which the relatives of the deceased must buy to have their loved one cremated here.,0
1464,I walked from my hotel past 20 or so ghats towards one of the main bathing ghats.,1
1465," The scene here was one some ways almost reminiscent of a sunny day in the summer at an English seaside resort - hundreds of people,",0
1466, The next day I also managed to find a stall recommended by the guidebook - The Blue Lassi - absolutely heavenly lassis flavoured with almost any available fruit.,1
1467, sheer number of people and the amount of people waiting to scam you all seem to conspire against you.,1
1468,The guidebook said 'give it a chance and this schizophrenic capital could capture your heart'.,0
1469, and maybe its just me that couldn't hack it (have not met a single traveller who liked it FYI)but I couldn't wait to get out of the place.,1
1470, transport used and even hotel rooms.,1
1471, and then at the end try to convince to go to some shop or tourism office they know.,0
1472, and also join in the game of trying to take you to a different hotel than you requested as yours is 'full'.,1
1473," or the hotel you booked is full or that the tourist office has moved,",1
1474," taxis and rickshaws who use the horn as though a conduit,",1
1475, There was some lovely architecture and easy to imagine this shah ruling over the people from his marble throne.,1
1476," they have left his room as it was that day showing his few worldly remains,",1
1477," My hotel in Pahargang called Cottage Yes Please (indian hotel names are amazing)was great and is also recommended to others,",1
1478, So overall New Delhi wasn't for me and the 3 days there were my limit and enough to see everything in my opinion.,1
1479," It is easy to stay longer than you planned and watch amazed at the sight before you,",1
1480," I love to people watch but the 2 days here nearly gave me enough memories to store for a lifetime,",1
1481, I'm not sure sitting in a cafe window and watching Cardiff people go by carrying their Tesco shopping or boutique handbags will ever be as interesting again.,1
1482," The area is full of heavily armed soldiers due to security issues and communal tensions,",1
1483, Thoroughly daunted already we (myself and an Aussie from hotel) went ahead.,1
1484," where pilgrims form a queue to make their offering of milk and flower by throwing it in a well,",1
1485," As we were with a hotel guide we were introduced to a priest who said he could get us in,",0
1486, it was only when back at the hotel I felt vaguely normal.,0
1487," Alka hotel is recommended for the amazing views from the balcony and decent price,",0
1488," but with enough filth to make you cross your legs,",0
1489, flowing fountains and water in front which allows you to see the Taj in perfect reflection and is also built on the bend of a serene river.,1
1490, To top it off I had a hotel which had a rooftop restaurant and it looked right at the Taj from nearby so I spent most of that evening gazing in wonder while drinking Indian beer and eating good food with people during the sunset.,1
1491," I have since found India a little easier to cope with since those first early mind frazzling days in Delhi,",0
1492, Outside the railway station there is a tourist office hotel booking agency so I went there first.,0
1493," It was useful that I did because when I mentioned that I wanted to stay near the station because I had to catch a train the next morning,",1
1494, he sorted out a hotel and a cycle rickshaw to take me there.,0
1495,After checking in at the hotel I just dumped my stuff and went straight back out and found a tuk tuk to take me to the Red Fort.,1
1496,"Back to my hotel then for a much needed shower,",0
1497, then spent an hour in an internet cafe before going to eat - had an excellent chicken curry in a really small local food shop (I couldn't really call it a restaurant!,1
1498, The train was also almost an hour late in leaving so I had a long wait on the platform where I had some breakfast (vegetable samosas!,0
1499," and there was a separate queue for foreigh tourists,",0
1500, I went outside and got a tuk tuk to one of the hotels recommended in the Lonely Planet India guide - The Shanti Lodge.,1
1501, This hotel has a rooftop restaurant with a superb view of the Taj Mahal.,1
1502," so this afternoon I just walked around all 3 sides of the Taj Mahal (it backs on to the river but you aren't allowed to walk along that side),",0
1503,On Tuesday morning I had breakfast on the roof garden of the hotel with the Taj Mahal in the background.,0
1504,A car picked us up from our hotel at 6am and we set off for Agra!,0
1505, taxi's - the lot!,0
1506, We had a few photos taken in front of it and suprisingly got to the front of a pretty small queue for the Diana seat and had a photo taken there - despite Graeme's reluctance to strike the Diana pose!,1
1507," The driver tried and tried to persuade us to """"take a look at my friend's shop until the rain stops"""",",1
1508, So after another long wait at the side of the road we were finally on our way.,0
1509, the children are never allowed to sit on the floor in schools.,0
1510, and stayed in a great motel once again with a pool ( No bats or monkeys!,0
1511," although I was sick for the majority of my stay here and it was extremely hot,",1
1512," We were picked up at the Delhi Airport and transported to """"The Connaught"""" hotel in New Delhi.",1
1513, who are not allowed to be burnt; 1.,0
1514, After the Holyman's informative chat he then hit us with how they need funds to run Hospice building where poor people come to die next to the holy ghat.,0
1515, He said that he hoped he could save enough money to buy them a shop!,0
1516," There are thousands and thousands of these tiny shops in the streets of Varanasi and that was his ambition for his children,",0
1517, At this point of time we deemed it necessary to take a little time off touring so on Kezia's advice we visited the Syria Hotel which had a pool that you could use and cool drinks.,1
1518, who went into the house while we bemused waited in the Jeep.,0
1519,) until we arrived at the hotel we were supposed to arrive at the following day!,0
1520," So after breakfast our immediate port of call was the hotel swimming pool,",0
1521,"restaurant (dragged out for a few hours as there was ac and a decent place to play cards in) having a meat platter,",1
1522, Then back to the pool and then back to the bar!,0
1523," The group booked through the hotel to go down,",1
1524, holy people and lepers were cast into the river rapped in shrouds as they were not allowed to be burnt.,0
1525,"through Agra to our hotel was not all that inspiring,",0
1526,"the road we managed to block it in both directions,",1
1527,especially after what we charge foreigners to see the sights of London.,1
1528, so i managed an auto in 200 rs to cover all major destination spots in agra.,1
1529, After putting my bagpack in the clock room and paying entry fee i entered.,1
1530, The train itself was not fancy or overly comfortable but we had a place to sit and a window to enjoy the views that passed by.,0
1531,As we sat waiting for our train to set of on the 3 1/2 hour journey to Agra we enjoyed watching the hustle and bustle of the train station from our safe quarters.,1
1532," Other than the room conditions,",0
1533," I plan on finding a good organization soon and making donations that way,",1
1534, with all the haze there wasn't much of a sunrise but at least it was still cool enough to enjoy our visit.,1
1535," A private car would be waiting for us at 2 pm to take us to our next destination,",1
1536, so we ran back to the shop and bought 10 more.,0
1537," pushing in queues and generally just causing unnecessary chaos,",1
1538, We decided to splash out on a $30 a night hotel and its like a palace.,0
1539," We have organised for the hotels tuk tuk driver,",1
1540, and charging you much more too.,0
1541,"The idea to book a hotel in Agra was a good one,",1
1542," The prepaid taxi driver from the train station to the hotel was all nice and charming,",1
1543, and you can hire this car for the whole day!,1
1544, the last time when we pulled off by the hotel with the Taj clearly in the view.,0
1545," you are informed that the ticket office is 1 km away,",0
1546, we walk there dodging rikshas and promising a teenage guy called Lucky to have a look at his shop after Taj.,1
1547," yes we will visit your shop we promise,",0
1548," I was stupid enough to have the swiss knife and a torch in my pocket,",1
1549, and these two are not allowed inside.,0
1550,---->These are not allowed inside.,0
1551,"The hotel I was staying in was filthy,",0
1552,Anyway if your thinking of staying here I would definately recommend against it.,0
1553, so no lights are really allowed in anyway.,0
1554, After this we managed to go back to sleep and have a bit of a lie in.,0
1555, We lugged our backpacks through the stinky alleys until we reached the car - which had managed to get down to the Ghats at this time of the day (no Pilgrms!,0
1556, We have included some photos of our 'hotel' with this blog.,0
1557, Mr Barun was waiting for us in the Arrival Hall at Delhi Airport.,0
1558, He drove us the half hour to our hotel wich was called The Residence and is located in South Delhi.,1
1559,The hotel is one of the best yet.,0
1560, The room was lovely.,0
1561," It has maintained its religious heritage since the 6th century BC in one continuous tradition,",1
1562," It is located on a ford on the river and is among the holiest of all tirthas ('crossing place'? These tirthas allow the devotee access to the divine,",1
1563,order to meet our guide for the day in the hotel reception.,0
1564, was waiting and immediately led us down the hotel steps to the river bank where there was a young boy waiting for us with a rowing boat.,1
1565, temples and palaces (of which our 'hotel' was one).,0
1566, Ajay informed us that they only send out one priest for the morning rituals (unlike the ceremony last night when there were quite a few).,0
1567," In reality the river is scummy with effluent (our hotel probably being one of the contributors - there is no sewage system),",0
1568, M looked a bit concerned and asked Ajay where the hotels did their laundry.,1
1569, and facilitating the final release for those lucky enough to pass away here.,0
1570, We were not allowed inside as you had to be a Hindu.,0
1571,Ajay arrived on time and we walked back through the alleys to the waiting car and driver.,1
1572, We returned to the hotel where over a Kingfisher D decided that Varinasi should have a new English name.,1
1573, There were four separate queues to get in.,1
1574, The men’s queue moved fairly swiftly but the women’s was painfully slow.,0
1575, The emperor was devastated by her death and wanted to create an unsurpassable monument to her memory and its name 'Taj Mahal' is simply an informal version of the title of the palace in which Mumtaz lived.,0
1576, The original structure would have been made of wood and scattered with luxurious carpets and the ceiling would have been covered with satin canopies.,1
1577, There is an identical building to the east which was only added to maintain the symmetry of the complex.,1
1578, We waited on the platform with our agent for the train.,0
1579, The journey to Bharatpur Station took us about two and half hours and we were met by the agent who was waiting outside our carriage.,0
1580, He took us to the waiting Mr Barun.,0
1581, who was to stay with us until we left Agra.,0
1582, It consists of 3 rooms and is also known as 'Blind Man's Buff House' as it is great for playing the ancient game.,0
1583,Next we went to the Anup Talao (Peerless Pool) which has a balustraded platform in the centre which is approached by 4 causeways.,1
1584, Sachin told us a little of the history of the building before we climbed aboard the tuk tuk and retuned to the car park and the waiting Mr Barun.,1
1585, We were not in a hotel this time but a homestay.,0
1586, This is where you stay in a room in someone's house.,0
1587," The room was clean,",0
1588, It was a bit of a rip off but was enough to curb our hunger.,1
1589, We stopped at a 'Wine Shop' and Mr Barun got us a couple of Kingfishers (he gets Indian prices of 70 rupees where we get charged 5 times that) to take back to the hotel.,0
1590,We will get a taxi to the railway station in a few hours and will arrive in Kolkata at 08.,0
1591, My ticket is confirmed but I do not have my Coach/Berth number so I go to the ticket office and the man goes on the railway internet site and gets my details for me.,1
1592,Now to wait for the train and wait I did.,0
1593, This afternoon Mirs wants some company to go shopping so a stroll of the town it is.,0
1594,About this time I managed to lock myself out of my room by snapping shut my padlock and leaving all the keys inside.,0
1595,I wait at the stop and try to find some shade as it is again a warm one.,1
1596,I sit next to a lad called Michael from Frankfurt and no sooner then we had said hello when in the seats in front are 2 of the volunteers from Holi in Jodhpur.,1
1597, We arrive have a look at the rooms which are ok and we are in.,0
