,Review,Rating
543, Most of the hotels were booked up so we after over an hour of searching accepted an 800 rupee bedroom at Hotel Diamond that wasn't even on their room listing.,1
544, we finally got a rickshaw to drop us at the Ganges and it wasn’t long before we had searched and found a room at Hotel Ganges View just south of Assi Ghat on the Ganges River.,1
545,Slightly above our budget (as we were in need of some pampering) we paid up the room for 6 nights for 9000 rupees and decided to sit tight with a little view for my birthday week.,1
546, After a few beeping horns and a great cheeky Chai I decided to head back to the room to take advantage of our satellite TV and comfy bed.,1
547, On our stroll from the south you begin by passing small lanes filled with dust that is created from the traffic and dried out cow dung that I have to say doesn’t make most of the streets in Varanasi comfortable to walk around.,1
548, The Ganges almost looked clean enough to swim in.,1
549, There is an art to using just enough wood to completely incinerate a corpse.,0
550," a taxi driver,",1
551,informed for sure.,1
552, We decided to take a train and pay a little more for an aircon express from a station a little way out of town to Kolkatta where we took night to rest in a basic room before saying goodbye to our mates Joe and Annie.,1
553," a three hour wait on KohSan rd,",0
554, The major problem is that in this area cars are not allowed so you have to leave your cab and take a cycle rickshaw.,0
555, Good hotels are few and rare.,0
556, I have stayed at the Lara hotel because of its location and its safe.,1
557, 500 - 700 to hire a small car.,0
558, they will charge you what comes to their mind so do haggle.,1
559, Prefer hotel cars as they will ensure cleanliness and safety.,1
560, Sandstone is the regional specialty the amazing thing about sandstone is that once you wash it with water it keeps your room fragrant with smell of wet earth.,1
561, Mobile phones and liquids are not allowed so either leave it in your hotel or deposit with the guy who keeps your shoes.,1
562,t(MISSING)emples don’t allow shoes.,0
563, You need to deposit your shoes and bags with shops near the temple gate and you can collect them on your way back.,1
564, In case of any doubts please talk to policemen they are your best source of information around the temple complex.,1
565, Do check the timing with your hotel and the closest ghat.,1
566, There is an old fort not very well maintained but in case you are into that you might consider visiting it.,0
567, Also if you can manage the chaos then Dev Deepawali in November is a spectacular scene.,0
568, so I thought I'll get back to the hotel two hours before the train so I can pack and chill before a 13 hour train journey.,1
569,I manage to just about find the platform and catch the train just in time because it's late.,0
570," then the fort and wait and take me to a restaurant,",0
571, and again wait then take me to the station.,0
572," I always assumed there'd be loads of different rooms and stuff,",1
573," stuck waiting for an hour,",1
574," also known as a rickshaw) to """"yogi lodge"""" recommended in the guide book,",0
575,"The rooms pretty clean,",1
576," explaining that everyone outside the walls of the hotel are crooks and liars,",1
577," You're stood outside a shop on a tiny street,",0
578, We were staying at Aman Homestay and they had sent a driver for us.,1
579, Once we settled into our rooms (which were really lovely) we showered then decided to head out for breakfast.,1
580, The homestay arranged a tuktuk for us for the day and our driver was waiting for us.,1
581, We headed off to the fancy Raddisson hotel nearby who had said we could use the gym.,1
582," A lady escorted us through the hotel (we felt very out of place in our gym gear) and showed us this amazing gym,",1
583,We then asked our tuktuk driver Vicky for a gym and he took us to the most dodgy looking hotel in the middle of nowhere.,1
584, It was so old school but there was HEAPS of equipment and they charged us a paltry $1 to use it!,1
585," Afterwards we headed back to the hotel and when we got there,",1
586, We retired to our rooms after dinner and had an early night as we were getting up early for sunrise at the Taj!,1
587, it was a short but lovely stay at Aman Homestay and Agra.,1
588,Up and out of the hotel by 5 am to catch the train to Agra.,1
589, We then headed off to our hotel to relax before heading out to see the Taj Mahal.,1
590,We returned to the hotel to change for dinner and then took a tuk-tuk to a nearby restaurant.,1
591, I ordered coffee from room service for the three if us.,1
592," and our room checked over for items missed,",1
593,I did manage to get my sari.,1
594,'efficient' head on at about 4.,1
595," Again we were not disappointed; it was cloudy,",1
596, but Emily and I managed to catch a few great photos just over a few minutes whilst it burst through a break in the clouds.,1
597," some people went back to the hotel; Tom,",1
598, that is so much easier with eight people than with 16!,0
599,"The train managed to arrive with only an hour and a half delay,",0
600, I did manage to get that.,1
601,Ankur put a smile on everyone's face this morning when he informed us that we are going to Agra.,1
602,We went back to our rooms for a bit of a rest as we had a couple of hours to kill before meeting back as a group.,1
603," Jude set the alarm to allow for a nap,",1
604,imam reliably informed by our guide Dushyant.,1
605, but we were not allowed to take any photos.,0
606, and also groups of people waiting on the steps with bound and covered bodies adorned with flowers waiting for them to be cremated.,1
607,Then we headed back to the hotel where I managed to catchup on some of my lost sleep from the crazy night train.,1
608, Mary and Steph waited until we hit the shore liNd and then paddled in.,1
609, We were not allowed to take photos of the cremation sire but we could take them from a distance.,0
610, let you take photos and then charge you thousands of rupees not to say anything.,0
611, Then a tuk tuk home to the hotel We got stuck in traffic and found ourselves being followed by a man who had taken a shine to Mary and was walking with his dick out in his hand.,1
612,"She and her husband have worked hard to move from living in a one bedroom place at the back of a shop to a lovely little new build home with separate bedrooms,",1
613,We arrived in plenty of time to catch the train so waited in the ladies only waiting room.,1
614," So eventually our guide asked the waiting room attendant to ask her to ove,",1
615, She tried to get it but couldn't so her husband tried but was holding all the passengers up waiting to get on.,1
616," We did have AC and a fan,",1
617,The AC was on full so it was cold but we didn't know how to get a blanket.,1
618, but sadly no that luxury was to be taken away from me.,0
619,Finally we were pulling into Varanasi we had to wait 45 mins in the heat with no AC and only a ceiling fan to keep us cool.,1
620, As usual we had to dodge to maic traffic and avoid an early death on the roads lol but we managed it and all arrived at the air conditioned hotel all in one piece.,0
621,We headed to our rooms for a quick shower and then meet for lunch in the restaurant.,1
622, In most hotel rooms on this trip we have had to insert the key fob in to a slot behind the door to activate the leccy and AC.,1
623, We were then advised we had not pushed the key fob in the right way or far enough so in fact all was ok with the leccy and it was also user error on the tap front too!,1
624,When we got back to the hotel guess what .,0
625, just the reception so the lobby was packed with guests and the sound of the party voices and music was coming up from the room the reception was being held in.,1
626, well as you can guess by lack of updates I have been having wifi issues.,1
627, This time it's intermittently on and off and I have to sit in a fan cooled room but it's still very warm.,1
628," We are staying in the same hotel,",1
629,10am we left the hotel and drove the short distance to the car park.,1
630, Ladies in one queue and gents in another.,0
631,After watching the kids playing and swimming etc we wandered further into the complex and climbed some stairs to a pool where people were swimming and kids playing.,1
632,Sorry I haven't blogged for the last couple of days but we had no internet access last night and the last evening in Jaipur my pay wifi ran out before I had time to do an update.,0
633, My internet time ran out in Jaipur before i could update my.,0
634, Yesterday we're were in Tordi Garh and the hotel had no wifi!,1
635, ventilation systems and lots of secret passages to allow the royal family to escape and cause confusion should the palace be invaded.,1
636, When this was happening no women were allowed in the vicinity.,0
637, Also they created a ventilation system which allowed air and light in but did not allow you tossed in or out of corridors and rooms.,1
638,had separate apartments and rooms and we're not allowed to talk to each other unless the marharjine gave them permission.,1
639,When they had children they here only allowed tomstaynwithntheir mothers until they were 5years old and were then moved to a separate area of the palace to be educated.,0
640,We then head lunch and head back to the hotel for a few hours r and r.,0
641," We are staying in a small family run hotel which is basic but clean and comfortable,",1
642, and has air conditioning in the rooms- bonus!,1
643, Once settled in our rooms we had some home cooked lunch and afterwards a few hours R and R.,1
644,We arrived in Jodhpur just after lunch and after checking in we sat in the hotel garden and had some lunch.,1
645, We had a nice meal and then went back to the hotel for guess what.,1
646, came back to our hotel to join in the festivities.,1
647," We went down to the hotel restaurant but the only breakfast was buffet,",0
648, Then we tried about 3 hotel restaurants down the road but all had their restaurant on the 5th floor which was too much to deal with at that point in time!,0
649, So we admitted defeat and went back to our hotel and had toast and chocolate milkshake!,1
650,After breakfast we went back to the room and lazed around until 12.,0
651, Miriam and myself went into the palace and spent a good few hours wandering around the beautifully decorated rooms and gardens.,1
652, which was about 40 minute drive from our hotel in Pushkar.,1
653,After dinner we walked back to the hotel and hit bed early as we had sunrise hike in the morning.,1
654, Myself and Krissy (who hadn't been very well) stopped just shy of the top and got comfortable on our personal rock seat.,1
655,After breakfast we went back to the hotel and went back to bed!,1
656," Slept until 3pm when we got up and all took a taxi into town,",1
657, stopping off at various shops on the way back.,0
658,We had dinner in the hotel restaurant and then had another party on the rooftop!,1
659, Today we had the luxury of a private air conditioned car and a departure time of 9.,1
660,Afterwards we went to a block printing shop and watched a demonstration of block printing prior to some retail therapy in the shop.,1
661,After lunch we went back to the hotel to get out of the heat for a few hours.,1
662, Purchases in hand we left and headed back to the hotel in a tuktuk for dinner and group briefing with Ankur.,1
663,We then went to a rooftop restaurant for dinner and back to the hotel for bed as early start for sunrise at the Taj.,1
664, Ashok took us to a great local and cheap eatery for lunch.,1
665, From here we got to our hotel for the night and Ashok dropped us off just outside the Jaipur walls so we could see the Jantar Mantar observatory and city palace.,1
666, which also has three sacred pools of water.,1
667, One of the pools has been taken over by thousands of monkeys that congregate there to swim and bathe.,1
668, The legend says that the three sacred pools are varying depths said to be two or three elephants high deep.,1
669, The hotel was very cheap and I think had India's dirtiest bath/bathroom for sure.,1
670, we had one guide (they thought we would need two) and one bike each (they wanted us to hire a rickshaw as well) we were off.,1
671, we still saw a decent amount and the guide kept us entertained pointing out different birds and telling us about a book he has coming out with the national geographic.,1
672, and internet for that matter!,1
673," it is the part when there is a taxi tour and the young boy is 'looking after' the car,",1
674,"bit of a mix up with us not being allowed to take a tripod in,",0
675,"We enjoyed the taxi trip a lot,",1
676," comfortable way to see Rajasthan,",1
677," We decided to ease our way in we would pre-arrange a taxi pickup with our hostel,",1
678, which was great as we didn't have to deal with hundreds of taxi drivers all wanting our fare.,1
679, although we did make a couple of pit stops - one to pick up the local chewing leaf (paan) from what seemed like his mates shop and then to swop drivers.,1
680, the stairways and landings looking quite old and run down but the room being ultra modern!,1
681, which the queue for was huge; there were hundreds of families all holding gifts to take into the temple.,1
682, and there are cremation ghats where bodies are cremated waterside allowing ashes to be washed away by the rivers.,1
683," Its best to be as ‘casual’ as possible and take a seat enough away from the action so you aren’t intruding but close enough you can see and take in the unique experience in a respectful way,",0
684," He took us up to a room on the 2nd floor of a derelict building over looking the Ghat,",1
685, are these bodies waiting to be burnt?,0
686," Lots of lots of people hire boats to go watch and also children (with fantastic English language·) sell you candles,",1
687, This turned into a huge scene with one of her friends jumping in to save her and she almost drowned him as well when finally a man in a fishing boat stuck his paddle out for her to hold onto and managed to drag her and her friends onto the boat!,1
688,As it was our first over night train journey we again eased our way in and went on AC first class.,1
689,"So we are staying put in our hotel,",1
690," For the past 3 or 4 years Singhji is no longer allowed to guide his tours through the Taj Mahal,",0
691," I was disappointed at the inside,",0
692,"We woke up bright and early the day after my birthday and decided it wasn’t worth moving rooms again - we had originally told Shiva we were moving to Jill and Richards when they left as it was slightly nice and had an aircon,",1
693,We had a nice brunch at OM then headed back to the hotel to get organized for a walking tour we had arranged with Varanasi Walks.,1
694, I tried to keep my balance as he pushed me until I saw a cow charging past me and into Taylor!,1
695, We were told to leave our shoes in a small alleyway at a little shop and to walk a short distance to the temple.,1
696, We were a little disappointed as it wasn't as good as previous ones we had eaten and we had really talked it up to Brandon who wasn't impressed with it at all!,1
697, We didn't have much planned for the day so we decided to just wander the back streets and do some shopping for scarves.,1
698,We found our way to Ba Ba Black Sheep - a silk and pashmina scarf shop recommended for its quality.,1
699, I then went back to the hotel and ate Nutella for dinner!,1
700," We curled up on the newspaper and waited for our train to arrive… Not long before the train turned up a lone cow meandered past slowly on our platform,",1
701, we had breakfast while we waited to check in.,1
702,"I told them to please wait and I bolted for the toilets,",1
703,"We made our way to find a taxi and met up with an Aussie couple,",0
704, Richard and Jill who just happened to be staying at the same guesthouse .,0
705, We shared a taxi with them to the guesthouse.,1
706,The taxi dropped us off at the main road and a guy met the taxi to then show us how to get to our guesthouse.,1
707, he seemed a little uneasy (given he had just given someone our room we booked) and so showed us to another room which was not what I had paid for.,1
708, I was extremely rude to him about it and was told that it was the only room but we could either A) swap with Jill and Richard or B) move the next day.,1
709, especially when I saw their room a little while later and it was extremely cute and just what I wanted!,1
710,I went downstairs to the room and started crying.,1
711, I cried myself to sleep and Taylor was kind enough to tuck me in when she came to bed later on.,1
712, and walked up to the rooftop to have a Chai and wait for her to rise.,1
713, We spoke to Shiva about changing rooms and he showed us a room similar to Jill and Richards.,1
714, We were staying at Munshi Ghat.,0
715, catching up on internet and chatting.,1
716, We went back to the room to chill out and eat nutella from the jar.,1
717, We were a little disappointed since we were there to have dinner and socialise.,0
718, as well as in CD shops playing Indian music.,1
719, I can tell you that it was not a disappointment indeed!,1
720, we managed to see a boa constrictor.,1
721, the city that was the Mughal capital for a decent amount of time back in the day.,1
722," Shah Jahan Function: Monument,",1
723, When I arrived in New Delhi I was meeting a friend and he still had not arrived yet so I waited in the baggage area for a while before deciding to go get a room at the Airport Lounge.,0
724," not allowed to stay in Delhi,",0
725, nor were we allowed to leave the airport because the fog was so heavy it was unsafe to drive.,0
726, it was safer to stay at the airport then try to get the driver to take us to Agra in the morning.,0
727,) It is more like a fort/castle thing with amazing gardens and pools and beauty everywhere.,1
728," but my friend and I REALLY wanted to see it one night so we were sneaking all over this hotel trying to find different ways up to the tower,",1
729, got off topic with the hotel thing there.,1
730,power in ruling the empire.,1
731, When it was my turn I was not brave enough to hold the snake so I got as close as I felt I could then smiled to the camera.,1
732, (we stopped at a carpet shop and saw how they were made.,1
733, That young girl had enough respect for me/herself/morals/karma to forget how hungry and cold she was and not take my stuff.,1
734," but I think the cultural differences of the Cast system or work related issues made it very uncomfortable for him,",1
735," I wasn't really prepared for when people said that part of your heart stays in India,",1
736,"Our hotel for the night was very swanky,",1
737, it really is such a contrast from the chaos outside to the serenity inside and of course the luxury and comfort inside to the poverty and sadness in the street.,1
738," being made in Jaipur were coming to the hotel tonight,",1
739, only 1 hour to wait for the gates to be opened.,0
740,Back to the hotel for a late breakfast and then straight off to visit Agra Fort - there is going to be no rest on this holiday but we don't mind when we are seeing all these amazing sights.,1
741, She was to be my next door neighbour at the new hotel I'd checked into: Hotel Sheela.,1
742, who rocked up out of nowhere and asked for a room (Thanks to a Lonely Planet recommendation mind you).,1
743, (Also interesting was that due to her religious beliefs she wasn't allowed to willingly make any physical contact with a man.,1
744," We were lucky enough to be the first people to get to the Taj,",0
745," They told me I had to wait half an hour for the booking,",0
746, which was enough time for the driver to take me to a shop!,0
747, I made it easier by announcing on arrival that I wouldn't buy anything.,0
748, We were in luck - all the celebrating would culminate in a procession that would be passing right next to our Hotel as they head down to the river to submerge effigies of the Goddess Durga into it.,1
749, and made it back to the hotel with everything intact.,1
750, This was a strong awakening to the standard of living and amount of poverty that was waiting us for the next 10 days.,1
751, our accomodation for the night.,1
752, with vast silk shops and colour and spice filling every section it was amazing!,1
753," the elephants allowed us to get up close to a pair of mother and calf Rhino's,",1
754," and wait until the next morning,",1
755, This left us to hang out in our surprisingly cheap but very nice hotel about 1km away from the Taj Mahal’s East Gate.,1
756, except these guys were a touch more persistent and literally tagged along with us from the moment we left the hotel to the second we arrived at the restaurant we decided to eat in.,0
757," far from having had enough of the mighty Taj Mahal,",1
758," and the fact that we would have rickshaw drivers hassling us and shop sellers dragging us into places wasn’t really anything new to us,",0
759, fairly quiet and the room was half decent albeit a little dark.,0
760, the resident hotel tour operator sat us straight down and kindly showed us a few things on the map.,1
761," We have been here long enough to know that this is code for ‘I’m gonna try sell you a tour before you step outside and get one cheaper’,",1
762, however the guy was friendly enough and we wanted to see what was on offer.,1
763," he quoted us what seemed a decent price,",1
764," we had decent seats,",1
765," however it was enough to put us out of action for a good 24 hours,",1
766," It really was an interesting and informative couple of hours finding out who did what,",1
767, fake ones loved it and charge you for the honour!,0
768, He used to have a shop in the market but for 10 years had not been able to face it.,0
769, and allowing thoughts to come and go without them taking over ones state of being.,1
770, The way he again let me be and felt comfortable to go and do that made me feel very accepted.,1
771, One important reason why its a good time is that internet connections actually work pretty well before 10am after which office India goes on-line.,1
772, although there are chai shops if I fancied an early stroll and chai.,1
773, But I stay in my room and waste an hour answering emails and working on blogs.,1
774, Now which of my favourite chai shops will I patronise this morning?,1
775, I have this mythological belief that its important to my chai shop 'friends' that I maintain patronage – what is that?,1
776,I suspect this baba is quite wealthy - he is always dressed immaculately and it seems obvious he has a decent place to live.,1
777, He runs a toilet-size shop selling this and that in his 'spare' time.,1
778, On the way through there is a sweet shop run by Vishnu who I met in 2010.,1
779, I visit Satish in his chai shop in the middle of the fruit and vegetable market which is right on the route taken by the funeral marches to the burning ghat.,1
780, The steps at the left of the picture (also submerged) is where Rama Guru ran his chai shop for at least the last 33 years (when I first met him).,1
781,On the way back to my room it starts to rain – heavily – but its just a 10 minute shower.,1
782,My room is the door in the middle of the pic!,1
783," Making my way back to my room after lunch,",1
784, one motor boat and manages one houseboat.,1
785, Its a joyous reunification and I am quickly feeling at home as I ditch my pants and shirt and apply my gumpcha as a lungi and sit comfortably in the Ganga breeze.,1
786, I am invited to stay for freshly netted fish which have drifted down from the mountains.,1
787, I buy a small sweet lassi and 100 grams of dahi (curd) from Shyam's shop at Assi Ghat.,1
788,Only small problem is that there is a wedding the next day next to my Guest House – friends of Deepak and Rajana – so they are availing the area right outside my room to the preparation of sweetmeats for the event – a rather noising undertaking which keeps me awake until 12.,1
789," Our hotel (Hotel Kamal,",1
790, and we could actually see it from our hotel roof.,1
791, Warning: you go through metal detectors and they don’t allow food or drinks other than water inside.,1
792, So order a thali to split and save room for dessert!,1
793, we also got a cheap cell phone.,1
794," an address (a hotel address is fine),",1
795, You can ask at your hotel for a recommended cell phone dealer.,1
796,We had another of my favorite experiences in India while eating breakfast on the hotel roof in view of the Taj Mahal.,1
797," One of the neighbors of the hotel happened to be on his roof with his daughter,",1
798," in the AC-3 compartment,",1
799," AC-3 means you have a bed to yourself,",1
800," wait for us,",1
801, All while I sit inside a modern air conditioned show room eyeing off the new bikes on display.,1
802,Riding into Ranchi (and its gotten dark now) I wonder about where I am going to find a decent place to stay.,0
803, there is the 'Midtown Hotel' staring at me.,1
804, the guy in the front shop assures me I am at the right place (its almost as if he were expecting me) and ushers me down the lane to the Reception.,1
805," arrange with said young Sikh to gain free access to a large A/C deluxe room in the morning so that I can do my hatha yoga,",1
806, and they will tell you: Rule #1 when traveling to New Delhi: “Watch out for scams”.,1
807, He kindly informed us that the Grand Bazaar had been closed off due to religious conflicts (Hindu-Muslim) that had taken place during the Ramadan festival.,1
808, He told us that in order to get into the area we had to go to the Government tourist office and get a pass (which is free) that confirmed we were staying at a hotel along the Bazaar.,1
809, Sure enough we arrived at an office with an official looking “Government of India: Tourism” sign.,1
